[
  {
    "id": "HAT003-PY-PYTHON-CORE-0001",
    "kind": "knowledge_card",
    "title": "Python statement and expression boundaries",
    "text": "Python statement and expression boundaries Static review card for python statement and expression boundaries in Python engineering. python_core syntax hat:003 domain:python execution:no review:human-required level:beginner source:official mV:-70.003.syntax",
    "status": "DRAFT",
    "canonical": false,
    "source_verification_status": "UNVERIFIED",
    "card_deepening_status": "NEEDS_CARD_DEEPENING",
    "execution_permitted": false,
    "human_review_required": true
  },
  {
    "id": "HAT003-PY-PYTHON-CORE-0002",
    "kind": "knowledge_card",
    "title": "Object identity equality and truthiness",
    "text": "Object identity equality and truthiness Static review card for object identity equality and truthiness in Python engineering. python_core data_model hat:003 domain:python execution:no review:human-required level:beginner source:official mV:-70.003.data_model",
    "status": "DRAFT",
    "canonical": false,
    "source_verification_status": "UNVERIFIED",
    "card_deepening_status": "NEEDS_CARD_DEEPENING",
    "execution_permitted": false,
    "human_review_required": true
  },
  {
    "id": "HAT003-PY-PYTHON-CORE-0003",
    "kind": "knowledge_card",
    "title": "Function arguments defaults and call semantics",
    "text": "Function arguments defaults and call semantics Static review card for function arguments defaults and call semantics in Python engineering. python_core functions hat:003 domain:python execution:no review:human-required level:beginner source:official mV:-70.003.functions",
    "status": "DRAFT",
    "canonical": false,
    "source_verification_status": "UNVERIFIED",
    "card_deepening_status": "NEEDS_CARD_DEEPENING",
    "execution_permitted": false,
    "human_review_required": true
  },
  {
    "id": "HAT003-PY-PYTHON-CORE-0004",
    "kind": "knowledge_card",
    "title": "Class attributes versus instance attributes",
    "text": "Class attributes versus instance attributes Static review card for class attributes versus instance attributes in Python engineering. python_core classes hat:003 domain:python execution:no review:human-required level:beginner source:official mV:-70.003.classes",
    "status": "DRAFT",
    "canonical": false,
    "source_verification_status": "UNVERIFIED",
    "card_deepening_status": "NEEDS_CARD_DEEPENING",
    "execution_permitted": false,
    "human_review_required": true
  },
  {
    "id": "HAT003-PY-PYTHON-CORE-0005",
    "kind": "knowledge_card",
    "title": "Exception hierarchy and explicit handling",
    "text": "Exception hierarchy and explicit handling Static review card for exception hierarchy and explicit handling in Python engineering. python_core exceptions hat:003 domain:python execution:no review:human-required level:beginner source:official mV:-70.003.exceptions",
    "status": "DRAFT",
    "canonical": false,
    "source_verification_status": "UNVERIFIED",
    "card_deepening_status": "NEEDS_CARD_DEEPENING",
    "execution_permitted": false,
    "human_review_required": true
  },
  {
    "id": "HAT003-PY-PYTHON-CORE-0006",
    "kind": "knowledge_card",
    "title": "Module boundaries and import side effects",
    "text": "Module boundaries and import side effects Static review card for module boundaries and import side effects in Python engineering. python_core modules hat:003 domain:python execution:no review:human-required level:intermediate source:official mV:-70.003.modules",
    "status": "DRAFT",
    "canonical": false,
    "source_verification_status": "UNVERIFIED",
    "card_deepening_status": "NEEDS_CARD_DEEPENING",
    "execution_permitted": false,
    "human_review_required": true
  },
  {
    "id": "HAT003-PY-PYTHON-CORE-0007",
    "kind": "knowledge_card",
    "title": "Absolute and relative import review",
    "text": "Absolute and relative import review Static review card for absolute and relative import review in Python engineering. python_core imports hat:003 domain:python execution:no review:human-required level:intermediate source:official mV:-70.003.imports",
    "status": "DRAFT",
    "canonical": false,
    "source_verification_status": "UNVERIFIED",
    "card_deepening_status": "NEEDS_CARD_DEEPENING",
    "execution_permitted": false,
    "human_review_required": true
  },
  {
    "id": "HAT003-PY-PYTHON-CORE-0008",
    "kind": "knowledge_card",
    "title": "Iterator protocol review",
    "text": "Iterator protocol review Static review card for iterator protocol review in Python engineering. python_core iterators hat:003 domain:python execution:no review:human-required level:intermediate source:official mV:-70.003.iterators",
    "status": "DRAFT",
    "canonical": false,
    "source_verification_status": "UNVERIFIED",
    "card_deepening_status": "NEEDS_CARD_DEEPENING",
    "execution_permitted": false,
    "human_review_required": true
  },
  {
    "id": "HAT003-PY-PYTHON-CORE-0009",
    "kind": "knowledge_card",
    "title": "Generator state and lazy evaluation",
    "text": "Generator state and lazy evaluation Static review card for generator state and lazy evaluation in Python engineering. python_core generators hat:003 domain:python execution:no review:human-required level:intermediate source:official mV:-70.003.generators",
    "status": "DRAFT",
    "canonical": false,
    "source_verification_status": "UNVERIFIED",
    "card_deepening_status": "NEEDS_CARD_DEEPENING",
    "execution_permitted": false,
    "human_review_required": true
  },
  {
    "id": "HAT003-PY-PYTHON-CORE-0010",
    "kind": "knowledge_card",
    "title": "Decorator transparency and metadata",
    "text": "Decorator transparency and metadata Static review card for decorator transparency and metadata in Python engineering. python_core decorators hat:003 domain:python execution:no review:human-required level:advanced source:official mV:-70.003.decorators",
    "status": "DRAFT",
    "canonical": false,
    "source_verification_status": "UNVERIFIED",
    "card_deepening_status": "NEEDS_CARD_DEEPENING",
    "execution_permitted": false,
    "human_review_required": true
  },
  {
    "id": "HAT003-PY-PYTHON-CORE-0011",
    "kind": "knowledge_card",
    "title": "Resource lifetime with context managers",
    "text": "Resource lifetime with context managers Static review card for resource lifetime with context managers in Python engineering. python_core context_managers hat:003 domain:python execution:no review:human-required level:intermediate source:official mV:-70.003.context_managers",
    "status": "DRAFT",
    "canonical": false,
    "source_verification_status": "UNVERIFIED",
    "card_deepening_status": "NEEDS_CARD_DEEPENING",
    "execution_permitted": false,
    "human_review_required": true
  },
  {
    "id": "HAT003-PY-PYTHON-CORE-0012",
    "kind": "knowledge_card",
    "title": "Type hints as review support",
    "text": "Type hints as review support Static review card for type hints as review support in Python engineering. python_core typing hat:003 domain:python execution:no review:human-required level:intermediate source:official mV:-70.003.typing",
    "status": "DRAFT",
    "canonical": false,
    "source_verification_status": "UNVERIFIED",
    "card_deepening_status": "NEEDS_CARD_DEEPENING",
    "execution_permitted": false,
    "human_review_required": true
  },
  {
    "id": "HAT003-PY-PYTHON-CORE-0013",
    "kind": "knowledge_card",
    "title": "Dataclass defaults and mutability",
    "text": "Dataclass defaults and mutability Static review card for dataclass defaults and mutability in Python engineering. python_core dataclasses hat:003 domain:python execution:no review:human-required level:intermediate source:official mV:-70.003.dataclasses",
    "status": "DRAFT",
    "canonical": false,
    "source_verification_status": "UNVERIFIED",
    "card_deepening_status": "NEEDS_CARD_DEEPENING",
    "execution_permitted": false,
    "human_review_required": true
  },
  {
    "id": "HAT003-PY-PYTHON-CORE-0014",
    "kind": "knowledge_card",
    "title": "Pattern matching exhaustiveness review",
    "text": "Pattern matching exhaustiveness review Static review card for pattern matching exhaustiveness review in Python engineering. python_core pattern_matching hat:003 domain:python execution:no review:human-required level:advanced source:official mV:-70.003.pattern_matching",
    "status": "DRAFT",
    "canonical": false,
    "source_verification_status": "UNVERIFIED",
    "card_deepening_status": "NEEDS_CARD_DEEPENING",
    "execution_permitted": false,
    "human_review_required": true
  },
  {
    "id": "HAT003-PY-PYTHON-CORE-0015",
    "kind": "knowledge_card",
    "title": "Async function boundaries",
    "text": "Async function boundaries Static review card for async function boundaries in Python engineering. python_core async_await hat:003 domain:python execution:no review:human-required level:advanced source:official mV:-70.003.async_await",
    "status": "DRAFT",
    "canonical": false,
    "source_verification_status": "UNVERIFIED",
    "card_deepening_status": "NEEDS_CARD_DEEPENING",
    "execution_permitted": false,
    "human_review_required": true
  },
  {
    "id": "HAT003-PY-PYTHON-CORE-0016",
    "kind": "knowledge_card",
    "title": "Thread process and async tradeoffs",
    "text": "Thread process and async tradeoffs Static review card for thread process and async tradeoffs in Python engineering. python_core concurrency hat:003 domain:python execution:no review:human-required level:advanced source:official mV:-70.003.concurrency",
    "status": "DRAFT",
    "canonical": false,
    "source_verification_status": "UNVERIFIED",
    "card_deepening_status": "NEEDS_CARD_DEEPENING",
    "execution_permitted": false,
    "human_review_required": true
  },
  {
    "id": "HAT003-PY-PYTHON-CORE-0017",
    "kind": "knowledge_card",